Handle,Timestamp,Content,Comments,Retweets,Likes
@tobi,2023-05-20T15:56:07.000Z,8 years public today. Went OK I think.,261,41,999
@brian_armstrong,2023-05-20T17:04:23.000Z,On friendship ,277,86,500
@WatcherGuru,2023-05-19T18:09:39.000Z,JUST IN:  Robert F. Kennedy Jr. becomes first presidential candidate to accept #Bitcoin campaign donations.,842,"2,181",11.4K
@vijaypande,2023-05-19T17:50:09.000Z,"1/ Did Scientists Accidentally Invent an Anti-addiction Drug?

People taking Ozempic for weight loss say they have also stopped drinking, smoking, shopping, and even nail biting.",262,556,"2,981"
@brian_armstrong,2023-05-18T23:12:50.000Z,"Become a Coinbase One subscriber to get zero trading fees, better rates on staking, and priority support.

It also supports us in our efforts to get regulatory clarity for the industry in the U.S.https://coinbase.com/one",914,184,"1,345"
@dwr,2023-05-18T19:39:44.000Z,Consumer-friendly apps drive onchain actions.,149,13,83
@brian_armstrong,2023-05-18T23:03:32.000Z,Yes - we have good custodial and self-custodial apps.,413,87,839
@FinancialCmte,2023-05-18T14:30:56.000Z,"#WATCH: Chairman  at today's stablecoin hearing:

""Without action from Congress ... stablecoin issuers will not feel confident to build their projects in the U.S.""

Read more  https://financialservices.house.gov/news/documentsingle.aspx?DocumentID=408801…  Watch his full remarks ",142,119,333
@coinbase,2023-05-18T19:48:43.000Z,"More USDC trading pairs means a faster and more rewarding Advanced Trade experience. 

See what else is coming soon to the platform. ",881,360,"1,056"
@jacqmelinek,2023-05-18T15:30:31.000Z,"EXCLUSIVE:  launches subscription service with focus on European expansion, starting with US, UK, Germany and Ireland",95,27,167
@iampaulgrewal,2023-05-18T18:25:51.000Z,One of the strengths of  is that our strongest technical talent is genuinely curious and thoughtful about law and policy. ’s summary of the Chair’s comments is yet another example.,101,37,271
@yugacohler,2023-05-18T18:07:27.000Z,"In the most recent episode of Odd Lots with  and , CFTC Chair Rostin Behnam made clear just how stark the differences in approach to crypto regulation are between his agency and Gary Gensler's SEC.

Here are the five takeaways:",39,84,259
@scottshapiro,2023-05-17T14:36:36.000Z,Improving trading for people around the world,96,24,139
@newlimit,2023-05-16T15:32:02.000Z,"We're excited to announce that we've raised our Series A from , , & ",35,29,145
@PerianneDC,2023-05-16T22:54:17.000Z,Coinbase is fighting a battle that will impact the industry for generations to come. The industry must unite to win. We stand with you  ,241,130,840
@milesjennings,2023-05-16T16:53:16.000Z,"SEC: Come in and register.
CB: We’d like to register.
SEC: You’re not allowed.
CB: Why not?
SEC: The rules are clear.
CB: The rules don’t make sense.
SEC: The rules are the rules.
CB: Can they be adapted?
SEC: Yes, but we don’t like your industry.
CB: But you've adapted rules…",328,"1,527","5,542"
@iampaulgrewal,2023-05-16T00:41:10.000Z,Today the SEC responded to Coinbase’s petition for a writ of mandamus — asking the court to require the SEC to respond just yes or no to whether it will undertake rulemaking for our industry. The SEC’s answer?   A resounding maybe. 1/7,390,982,"3,245"
@brian_armstrong,2023-05-16T06:54:33.000Z,,245,172,892
@brian_armstrong,2023-05-12T17:54:28.000Z,"Welcome , , , , and   to the Coinbase Global Advisory Council.  Excited to work with you to update the financial system and get regulatory clarity for crypto.",264,226,"1,438"
@eladgil,2023-05-11T14:39:04.000Z,New Druckenmiller (with slides):…https://uscmarshallweb.s3-us-west-2.amazonaws.com/assets/uploads/s1/files/keynote_speech_of_stan_druckenmiller_at_the_37th_usc_marshall_center_for_investment_studies_annual_meeting_may_1_2023_hdmqn6eb4m.pdf…,68,29,165
@brian_armstrong,2023-05-09T14:58:47.000Z,"A pleasure meeting Her Excellency SCA CEO Dr Maryam Al Suwaidi and His Excellency Ahmed Jasim Al Zaabi, Chairman ADGM.

A welcome message: “We regulate through engagement, not enforcement”.",543,489,"3,181"
@iampaulgrewal,2023-05-08T20:15:22.000Z,"”Confrontation isn’t really the purpose. It’s frankly not even something I particularly enjoy. But I do think that there are moments when it’s important to simply be public about the disagreements we may have from time to time, and also be very clear that the disagreements are…",104,48,340
@brian_armstrong,2023-05-09T07:20:32.000Z,"Great meeting with H.E. Dr. Thani bin Ahmed Al Zeoudi, UAE Minister of State for Foreign Trade Very impressive what they’ve done on free trade in the region, and establishing UAE as a financial hub.",336,355,"2,953"
@brian_armstrong,2023-05-08T13:25:49.000Z,Thank you for hosting me  and for the great interview ,116,75,479
@brian_armstrong,2023-05-08T13:26:11.000Z,,42,19,174
@brian_armstrong,2023-05-08T12:32:45.000Z,Great meeting with Minister of Economy H.E. Abdulla Bin Touq Al Marri in UAE ,362,533,"4,665"
@brian_armstrong,2023-05-08T08:48:45.000Z,"The UAE  deserves a lot of credit for being forward thinking on crypto. First dedicated crypto regulator in the world, a clear rule book published (!), business friendly plus strong customer protections. Really enjoying my visit so far.",484,"1,149","6,883"
@NanaMurugesan,2023-05-08T08:42:17.000Z,"8/ In UAE for a few days with the  team and . Crypto and web3 serve as enormous opportunities for economic and technological diversification for the UAE, and the region has the potential to be a strategic hub for Coinbase. https://coinbase.com/blog/the-uae-recognising-the-transformative-potential-of-the-cryptoeconomy…",45,30,242
@karpathy,2023-05-06T16:56:07.000Z,"Oops haven't tweeted too much recently; I'm mostly watching with interest the open source LLM ecosystem experiencing early signs of a cambrian explosion. Roughly speaking the story as of now:

1. Pretraining LLM base models remains very expensive. Think: supercomputer + months.…",156,"1,079","6,108"
@sama,2023-05-06T16:00:19.000Z,"US debt to GDP ratio over time. very scary chart; no plan to fix it or even much of an acknowledgement we need a plan.

will get made worse as the rest of the world finds alternatives to the USD and rates stay non-zero.

long-term brewing crisis.",791,"1,312","8,080"
@iampaulgrewal,2023-05-03T23:06:37.000Z,"The Third Circuit just issued a text-only order directing the SEC to file a response to our mandamus petition within 10 days (and gave us 7 days for a reply). Here’s the text of the order:

TEXT ONLY ORDER (Clerk) At the direction of the Court, Respondent is ordered to file an…",154,456,"2,134"
@brian_armstrong,2023-05-03T19:11:48.000Z,Wow - well said,189,529,"4,624"
@brian_armstrong,2023-05-03T19:04:10.000Z,,97,125,893
@fintechfrank,2023-05-02T13:10:14.000Z,My latest: Coinbase launches international perps exchange — starting with 5x leverage,39,34,267
@_tonylewis,2023-05-02T08:04:46.000Z,"This three minute masterclass by  on why fiat money is bad money is both hilarious and revealing. 

Share it with anyone who has no clue about money.",83,"1,031","2,644"
@brian_armstrong,2023-05-02T18:14:23.000Z,Great progress - lots of small details add up,102,26,441
@yugacohler,2023-05-02T14:31:14.000Z,"Coinbase will continue to innovate, build, and ship new products, no matter the regulatory climate. We will do so here in the U.S., and we will also do so globally.",15,16,215
@maxbranzburg,2023-05-01T17:50:35.000Z,"April was a pivotal month for crypto and , and I’m so proud of the work we’ve done together

We’re putting in the blood, sweat, and tears to advocate for sensible crypto policies while also launching exciting new products to advance the ecosystem

A few highlights ",27,21,232
@litocoen,2023-05-02T02:05:20.000Z,"now a coinbase one member

just a lil thing to support  in their legal battles",25,21,189
@coinbase,2023-05-02T13:06:39.000Z,Today Coinbase launched Coinbase International Exchange  and will begin by offering BTC & ETH perpetual futures settled in USDC with up to 5x leverage to institutional clients in eligible jurisdictions outside of the U.S.,805,"1,816","6,662"
@laurashin,2023-04-28T13:04:00.000Z, Is there a silver lining for crypto regulation? Law professor  says there’s a doctrine that might save the day. Listen: https://unchainedcrypto.com/podcast/coinbases-legal-action-against-the-sec-how-it-will-likely-unfold/…,76,76,236
@Eug_Ng,2023-04-28T10:44:43.000Z,"Strong message from the top dog regulator in Hong Kong. This is going to unleash waves of offshore capital flowing back into . 

Strategic move especially with the demise of US crypto banks.   

The tide is indeed riding high in the East. LFG!",77,180,615
@coinbase,2023-04-28T20:14:16.000Z,"We stand united with the crypto community in our effort to advocate for sensible crypto policy. So far, we've seen: 80K shield NFTs minted 40K sign-ups for #Crypto435 70K votes for pro-crypto legislation

Join the cause. Stand with crypto. http://coinbase.com/standwithcrypto",680,"1,035","3,286"
@brian_armstrong,2023-04-28T04:41:06.000Z,The most recent episode of  with  is ,123,98,664
@brian_armstrong,2023-04-27T19:22:51.000Z,"1/  Today we’re sharing our “Wells response” to the SEC. As part of our response,  and I sat down to explain why we’re confident in the facts and on the law, and why a Wells notice is not in the best interest of the US.",349,"1,044","4,556"
@brian_armstrong,2023-04-27T19:23:40.000Z,"3/ If you care about clear crypto regulation, sign up for #Crypto435 to join nearly 40,000 other people from across all 435 Congressional Districts to make your voice heard on crypto policy.",54,100,722
@brian_armstrong,2023-04-27T19:23:50.000Z,4/ And mint your Stand with Crypto shield NFT.,138,114,641
@brian_armstrong,2023-04-27T18:56:06.000Z,"Now up to 56,300 minted ",371,427,"2,690"
@brian_armstrong,2023-04-26T01:03:08.000Z,Wow,"1,147","2,645",10.4K
@jessepollak,2023-04-25T14:17:06.000Z,"brought my 95yo grandparents to our “demo day” at the Senate:

1. 50x cheaper remittances with stablecoins
2. more empowered creators with NFTs 
3. sovereign onchain identity with  
4. stronger local economies with  

if they can learn, so can our politicians.",65,52,425
@coinbase,2023-04-24T21:29:37.000Z,1/ The community is clearly fired up about sensible crypto policy. Here’s how to continue the support : Mint a Stand With Crypto commemorative NFT: Add a shield emoji next to your Twitter display name  http://coinbase.com/standwithcrypto,"1,116","5,123","6,859"
@brian_armstrong,2023-04-25T00:58:47.000Z,Important development,228,607,"4,763"
@brian_armstrong,2023-04-25T00:59:00.000Z,Read more herehttps://coinbase.com//blog/coinbase-takes-another-formal-step-to-seek-regulatory-clarity-from-sec-for…,32,44,433
@brian_armstrong,2023-04-25T00:52:35.000Z,I just minted Stand with Crypto,343,517,"3,427"
@wmougayar,2023-04-21T12:08:30.000Z,"“The courts are not an efficient place to resolve classification issues in securities.” “Europe is trying to figure out how to bring crypto into the financial system, whereas the US policy is on keeping it out of the system.” says former  chairman Jay Clayton ",89,117,492
@brian_armstrong,2023-04-21T22:35:08.000Z,"Farewell DC, flying back to west coast now to focus on improving our products. The best thing we can do for policy is drive utility and make crypto more useful, growing from a couple hundred million crypto users to a billion (as an industry).

It’s time to build!",413,444,"4,338"
@brian_armstrong,2023-04-21T17:42:54.000Z,Join us live from the Capital in 15 minutes for this twitter spaces on how we get crypto policy working in America ,159,239,"1,834"
@brian_armstrong,2023-04-21T17:30:22.000Z,"Met with the SEC today. We’ll continue pushing for a clear rule book in the U.S. for crypto regs.

The U.S. can’t afford to fall behind on this important technology to update the financial system.

Also important for regulators to set policy and THEN enforce it. Not start with…","1,073","1,975",11.9K
@brian_armstrong,2023-04-20T22:55:51.000Z,"Spent the day in DC meeting with members of congress. We need regulatory clarity in the U.S. for the centralized players in crypto for many reasons - consumer protection, national security, economic growth, etc.

The SEC has caused untold harm to America with its policy of…",850,"1,457",10K
@coinbase,2023-04-20T17:35:47.000Z,The 's adoption of #MiCA is a pivotal moment for crypto regulation. This comprehensive framework will give crypto organizations the confidence to invest and grow in the region.,127,229,859
@dwr,2023-04-20T00:25:03.000Z,"This is an utter failure of the US regulatory apparatus.   

Coinbase and several other regulation-first companies have been trying for nearly a decade to offer licensed derivatives in the US.",63,201,"1,506"
@BermudaPremier,2023-04-20T00:22:08.000Z,"Exciting news! Leading Digital Asset company   announced today that it has received a Digital Asset Business Licence from the #Bermuda Monetary Authority. 

I'm thrilled to see our island leading the “race to the top” for regulation in this industry, as our trusted…",3,103,571
@faryarshirzad,2023-04-20T16:15:34.000Z,"In the UK Mon/Tue, now in DC today and tmrw.  Excellent meetings with D & R leaders who understand the need for regulatory clarity, and the need to keep the US in the lead on digital asset & crypto innovation.      ",26,40,262
@brian_armstrong,2023-04-20T14:34:47.000Z,It’s a great question,292,714,"5,442"
@coinage_media,2023-04-19T21:25:12.000Z,"CAUGHT RED HANDED: SEC Chair Gary Gensler blamed crypto for Signature Bank's failure during his congressional testimony.

Today, NY Department of Financial Services Superintendent Adrienne Harris refuted that in front of the same committee:

""It is not the case that the failure…",341,"1,739","5,615"
@frantzfries,2023-04-17T18:38:36.000Z,"Buzzword salad warning but chatgpt + whisper + eleven labs + VR

Add some memory for past conversations and improve the lag and it’s over

I could see people just losing their lives to this

Just watch the video",268,983,"3,216"
@samwhoo,2023-04-10T14:13:26.000Z,"I've had this in the works for quite a while now, very excited to publish it. Bottom up, animated guide to HTTP load balancing algorithms.http://samwho.dev/load-balancing/This is probably one of the most ambitious pieces of writing I've ever done. I would love feedback. ",30,116,318
@BanklessHQ,2023-04-18T21:46:30.000Z,"We're in the second movie now

The Regulators Strike Back",117,308,"1,863"
@brian_armstrong,2023-04-18T17:59:30.000Z,FT todayhttps://coinbase.com/updatethesystem,229,634,"4,155"
@MatthewHyland_,2023-04-18T14:35:40.000Z,"""Is #Ethereum a commodity or a security?""

Gary Gensler attempts to answer a yes or no question:",345,682,"2,318"
@PatrickMcHenry,2023-04-18T15:04:29.000Z,"For two years, Democrats gave  a pass for his disastrous agenda. It's time for accountability. From his destructive climate disclosure rule to his regulation by enforcement of digital assets, Chair Gensler’s agenda has weakened capital markets & stifled innovation.",743,"1,754","7,568"
@brian_armstrong,2023-04-17T17:18:57.000Z,"Great meeting today with UK Economic Secretary and City Minister .

The UK is moving fast on sensible crypto regulation to both drive economic growth AND consumer protection. Excited to keep investing in the UK. ",483,734,"4,584"
@brian_armstrong,2023-04-17T17:59:13.000Z,More here:,85,67,535
@brian_armstrong,2023-04-17T17:59:49.000Z,"A few points we shared:

1. Some UK banks are blocking fiat payments to crypto companies which is not ok.
Good fraud controls make sense, a blanket ban does not (and is likely not lawful). Needs further education and collaboration.

2. The Financial Promotion regime goes too far…",83,65,633
@coinbase,2023-04-17T16:22:26.000Z,"The UK and Europe are vital to the Coinbase mission. We may be a US-listed company, but if we're to succeed in creating more economic freedom in the world, we have to be active globally.https://coinbase.com/blog/the-uk-as-a-web3-innovation-hub…",229,337,"1,582"
@Rainmaker1973,2023-04-17T08:16:04.000Z,"Starship orbital test flight's primary expected time is today. The launch window is expected to open at 8 am in Texas (13:00 UTC - 15.00 CEST). 

These are the Super Heavy and Starship expected trajectories

[watch: http://spacex.com/launches]
[ Cindy Pom]",81,689,"3,515"
@brian_armstrong,2023-04-17T07:29:47.000Z,"Good point. There is actually quite a lot of usage beyond speculation also. 

And getting 2-300m people who’ve tried crypto in a decade is really good. If this growth rate continues, will be 2-3b in 10 years, roughly similar to internet adoption. 

Key unlocks will be scalability…",113,143,900
@brian_armstrong,2023-04-17T07:13:34.000Z,"Really happy with how this progress update turned out for  

Lots of work ahead!",66,20,171
@brian_armstrong,2023-04-17T07:14:46.000Z,Follow  and check out https://newlimit.com/careers to apply or refer candidates,29,3,36
@brian_armstrong,2023-04-16T19:48:49.000Z,Interesting,107,101,765
@zosegal,2023-04-14T01:27:15.000Z,"Thanks   for the warm welcome in Vietnam!  

I was inspired by all the web3 builders I met, and excited for the innovation to come from Vietnamese builders.",304,158,500
@hturan,2023-04-13T12:25:18.000Z,"we’re lying on the moon.

here are a few models glued together — speech to text ( whisper) to text ( gpt-3.5-turbo) to speech () — to recreate samantha from “her” in real-time.",224,442,"2,365"
@brian_armstrong,2023-04-14T00:11:49.000Z,Going live in 20 min!,63,36,393
@byersblake,2023-04-12T22:37:40.000Z,For those curious about our quest  to reverse aging. We are presenting our work over the last 6 months and our plans over the coming years in a livestream at 5:30pm pst tomorrow 4/13.,135,35,141
@brian_armstrong,2023-04-12T19:58:53.000Z,"The  team will be hosting a special Progress Update tomorrow at 5:30pm Pacific.

Goal is to share more about early work to try and extend human healthspan using epigenetic reprogramming. 

Tune in to the livestream here:",67,53,351
@iampaulgrewal,2023-04-12T15:49:58.000Z,Let's go after criminals.  Not code.   presents a compelling case against OFAC's unlawful sanctions of Tornado Cash software.,32,67,335
@alexandrosM,2023-04-04T16:36:20.000Z,"STOP THE PRESS (like, literally)

A simple demonstration of how GPT can change the news, forever.

Prompt: ""What can be changed in the article below to make it more informative, truth-focused, and neutral?""

Left: original text
Right: rewritten text

Read",69,294,967
@vijaypande,2023-04-11T23:19:38.000Z,"Of all of the regulatory agencies, it’s odd for  to suggest that the FDA is the most natural example of how to perform AI regulation.

That suggests his base-case belief is that 
1) most AI is dangerous –– eg most molecules are toxic and 
2) it’s not clear if any given AI…",34,36,237
@davidmarcus,2023-04-11T18:01:22.000Z,"Thrilled to unveil the  Platform today. We believe the Internet badly needs an open payment protocol. One that works 24/7, settles in near real-time, is dirt cheap, interoperable, and open to all to build on. Money should move online like emails or text messages, and…",227,359,"1,750"
@TrungTPhan,2023-04-06T16:39:13.000Z,"The Costco hot dog combo is a legendary meme.

But how does it still only cost $1.50? Introduced in 1985, the price of that combo should be ~$4.20 if adjusted for inflation. 

Thankfully, the $216B warehouse retailer has done everything in its power to keep the price down.

And…",831,"4,431",37.4K
@brian_armstrong,2023-04-07T01:13:35.000Z,"If you're using crypto in Africa, reply with a short video (<30 seconds) or photo of how you're using it. Best few examples get $100 in crypto. Use hashtag #CryptoAfrica And if you haven't already, try out self-custodial Coinbase Wallet - send feedback",580,297,"1,410"
@maxbranzburg,2023-04-06T18:26:32.000Z,"Identity is better onchain

Low key nice step towards more useful onchain identities by  with ",96,21,74
@coinbase,2023-04-06T16:42:32.000Z,Web3 profiles = Unlocked Go claim yours ,224,284,718
@brian_armstrong,2023-04-05T23:13:19.000Z,Great act of kindness from the community ,151,128,"1,295"
@brian_armstrong,2023-04-05T23:11:35.000Z,Great update on the Tornado Cash case we helped support.,67,87,671
@brian_armstrong,2023-04-05T21:00:22.000Z,Thanks for the assist! Hopefully everyone who replied got theirs. Curious to see what gets built.,77,29,265
@elonmusk,2023-04-05T09:27:48.000Z,"Very sorry to hear that. Many people I know have been severely assaulted.

Violent crime in SF is horrific and even if attackers are caught, they are often released immediately.

Is the city taking stronger action to incarcerate repeat violent offenders ?","4,739",11.5K,100.4K
@coinbase,2023-04-04T17:01:44.000Z,"It shouldn’t be so expensive just to send money to someone in another country. It’s fast, cheap, and simple to send crypto to anyone, anywhere in the world.

It's time to update the system. ",576,571,"2,260"
@brian_armstrong,2023-04-04T20:27:14.000Z,"If any developers are interested in trying out Base, reply with your ENS name or address, and I'll send you some Base Goerli ETH to use on testnet. (yes, these are testnet coins)",569,203,"1,526"
@brian_armstrong,2023-04-04T21:30:22.000Z,Shoot we need a desktop version of Coinbase Wallet - hard to send all these out on mobile lol,24,17,226
@brian_armstrong,2023-04-04T22:01:48.000Z,"Ok turning off replies for now - lots of interest!

We'll work through these.

For those we didn't get to, check out our faucet http://coinbase.com/faucets",0,7,75
@brian_armstrong,2023-04-04T22:01:22.000Z,"Ok turning off replies for now - lots of interest!

We'll work through these.

For those we didn't get to, check out our faucet http://coinbase.com/faucets",46,30,245
@coinbase,2023-04-04T20:02:15.000Z,"People in the US spend over $12B/year in fees to send money abroad, yet the process for international transfers is shockingly slow and expensive. Crypto transfers are significantly faster and +96% cheaper, relieving the burden of supporting those abroad.",480,995,"3,219"
@brian_armstrong,2023-04-04T00:04:50.000Z,,120,290,962
@brian_armstrong,2023-03-31T00:27:50.000Z,"Count me among the people who think this is a bad idea.

There are no “experts” to adjudicate this issue, and many disparate actors will never agree. Committees and bureaucracy won’t solve anything.

As with many technologies, there are dangers, but we should keep marching…",355,329,"2,375"
@brian_armstrong,2023-03-30T23:52:06.000Z,Paid Well done app!,108,49,455
@brian_armstrong,2023-03-29T21:20:57.000Z,We need to hear from our U.S. leaders,433,962,"4,618"
@iampaulgrewal,2023-03-29T17:24:43.000Z,Land that I love:  wake up.  We don't have a God-given right to lead any innovation. Other countries aren't just sitting around.,78,181,"1,006"
@faryarshirzad,2023-03-29T04:25:19.000Z,"Meanwhile, in Hong Kong, China...",75,66,327
@iampaulgrewal,2023-03-27T15:42:17.000Z,"A security can apparently also be a commodity, except when it's not. And it depends on which regulator you ask, and when.  If you're confused, you are not alone. Is this really the best American law has to offer?",277,592,"2,432"
@brian_armstrong,2023-03-27T18:56:33.000Z,Well said  ,150,177,"1,303"
@0xmillie_eth,2023-03-26T14:43:43.000Z,Coinbase is making a Request for Builders on their L2 and one of the products they want to incubate is a non-fiat pegged stable ,167,175,779
@brian_armstrong,2023-03-25T20:05:19.000Z,"I have to say this SEC wells notice has caused a noticeable boost in morale.

Nice to have a common cause, but never forget the main goal is to build better products for our customers. Improving the policy landscape is necessary but not sufficient.",901,900,"8,126"
@tobi,2023-03-24T20:21:15.000Z,"mountain climbers call this type 3 fun

- Not fun in the moment (like icecream, that's type 1) 
- Not fun right after (gym, that's type 2) 

Eventually you remember it fondly and deem it as having been worth it. 

IMO founder success is often capped by max acceptable type3",23,54,565
@sandeepnailwal,2023-03-23T07:17:26.000Z,"So confused with this notice to . 

Coinbase is the gold standard of compliance in crypto. As a regulator, why would you go after the most compliant company of the industry?

Doesn’t it discourage everyone else trying to be US compliant?

Whats going on over there in US?",302,287,"2,010"
@brian_armstrong,2023-03-23T21:20:41.000Z,"I just voted ""Support Crypto"" on ""We want to innovate in America"" https://snapshot.org/#/crypto435.eth/proposal/0xf9628ebee2878f5667aa018537eda2266c085d58772bd6ee562899189657c07e… #Crypto435 ",212,186,931
@brian_armstrong,2023-03-23T21:03:12.000Z,Beautiful,56,24,296
@coinbase,2023-03-23T20:40:32.000Z,"Updating the system will take the voices of many. 
Register here to have yours heard: https://snapshot.org/#/crypto435.eth/proposal/0xf9628ebee2878f5667aa018537eda2266c085d58772bd6ee562899189657c07e…",340,406,"1,108"
@brian_armstrong,2023-03-23T19:58:44.000Z,We’re live,56,65,382
@brian_armstrong,2023-03-23T17:46:12.000Z,There’s a lot to discuss on the current crypto regulatory environment and we want to make these conversations transparent so the whole community can get involved. Join us at 1pm PT today.,104,179,"1,091"
@adamscochran,2023-03-22T21:51:37.000Z,"Oh PS - if Coinbase does indeed choose to fight the SEC as they are saying they will, then I'm:

-Moving all my purchases to Coinbase
-Moving all my trading to Coinbase
-Delegating to Coinbase staking nodes

If they go to bat for this industry, I'll vote with my wallet. ",334,807,"5,951"
